{
  "$schema": "https://raw.githubusercontent.com/DjobaDELATV/seygo_data/main/schema/v1/card.json",
  "id": "a266ca9b-2856-4ce6-8f7b-992e422e2e2a",
  "text": {
    "en": {
      "name": "Kairo Ryu-Ge Emva",
      "effect": "You can discard this card; add 1 \"Ryu-Ge Realm - Sea Spires\" from your Deck to your hand. During your Main Phase, if 2 or more monsters were sent from the hand and/or Deck to the GY this turn, except \"Kairo Ryu-Ge Emva\": You can Special Summon this card from your GY. You can place 1 \"Ryu-Ge Realm - Sea Spires\" you control on the bottom of the Deck; banish your opponent's entire hand, and if you do, they draw the same number of cards. You can only use each effect of \"Kairo Ryu-Ge Emva\" once per turn."
    },
    "fr": {
      "name": "Kairo Ryu-Ge Emva",
      "effect": "Vous pouvez d\u00e9fausser cette carte ; ajoutez 1 \"Royaume Ryu-Ge - Fl\u00e8ches de Mer\" depuis votre Deck \u00e0 votre main. Durant votre Main Phase, si min. 2 monstres (\"Kairo Ryu-Ge Emva\" exclu) ont \u00e9t\u00e9 envoy\u00e9s depuis la main et/ou Deck au Cimeti\u00e8re ce tour : vous pouvez Invoquer Sp\u00e9cialement cette carte depuis votre Cimeti\u00e8re. Vous pouvez placer 1 \"Royaume Ryu-Ge - Fl\u00e8ches de Mer\" que vous contr\u00f4lez au-dessous du Deck ; bannissez toute la main de votre adversaire, et si vous le faites, il pioche le m\u00eame nombre de cartes. Vous ne pouvez utiliser chaque effet de \"Kairo Ryu-Ge Emva\" qu'une fois par tour."
    },
    "de": {
      "name": "Kairo Ryuge Emva",
      "effect": "Du kannst diese Karte abwerfen; f\u00fcge deiner Hand 1 \u201eRyuge-Reich - Meeresspitzen\u201c von deinem Deck hinzu. W\u00e4hrend deiner Main Phase, falls in diesem Spielzug 2 oder mehr Monster von der Hand und/oder dem Deck auf den Friedhof gelegt wurden, au\u00dfer \u201eKairo Ryuge Emva\u201c: Du kannst diese Karte als Spezialbeschw\u00f6rung von deinem Friedhof beschw\u00f6ren. Du kannst 1 \u201eRyuge-Reich - Meeresspitzen\u201c, das du kontrollierst, unters Deck legen; verbanne die gesamte Hand deines Gegners und falls du dies tust, zieht er dieselbe Anzahl Karten. Du kannst jeden Effekt von \u201eKairo Ryuge Emva\u201c nur einmal pro Spielzug verwenden."
    },
    "it": {
      "name": "Kairo Ryu-Ge Emva",
      "effect": "Puoi scartare questa carta; aggiungi 1 \"Reame Ryu-Ge - Spire del Mare\" dal tuo Deck alla tua mano. Durante la tua Main Phase, se 2 o pi\u00f9 mostri sono stati mandati dalla mano e/o Deck al Cimitero in questo turno, eccetto \"Kairo Ryu-Ge Emva\": puoi Evocare Specialmente questa carta dal tuo Cimitero. Puoi mettere 1 \"Reame Ryu-Ge - Spire del Mare\" che controlli in fondo al Deck; bandisci tutta la mano del tuo avversario e, se lo fai, lui pesca lo stesso numero di carte. Puoi utilizzare ogni effetto di \"Kairo Ryu-Ge Emva\" una sola volta per turno."
    },
    "pt": {
      "name": "Kairo Ryu-Ge Emva",
      "effect": "Voc\u00ea pode descartar este card; adicione 1 \"Reino Ryu-Ge - Espirais Mar\u00edtimos\" do seu Deck \u00e0 sua m\u00e3o. Durante sua Fase Principal, se 2 ou mais monstros foram enviados da m\u00e3o e/ou do Deck para o Cemit\u00e9rio neste turno, exceto \"Kairo Ryu-Ge Emva\": voc\u00ea pode Invocar este card por Invoca\u00e7\u00e3o-Especial do seu Cemit\u00e9rio. Voc\u00ea pode colocar 1 \"Reino Ryu-Ge - Espirais Mar\u00edtimos\" que voc\u00ea controla no fundo do Deck; bana toda a m\u00e3o do seu oponente e, se isso acontecer, ele compra o mesmo n\u00famero de cards. Voc\u00ea s\u00f3 pode usar cada efeito de \"Kairo Ryu-Ge Emva\" uma vez por turno."
    },
    "es": {
      "name": "Kairo Ryu-Ge Emva",
      "effect": "Puedes descartar esta carta; a\u00f1ade a tu mano 1 \"Reino Ryu-Ge - Chapiteles de Mar\" en tu Deck. Durante tu Main Phase, si 2 o m\u00e1s monstruos en la mano y/o Deck fueron mandados al Cementerio este turno, excepto \"Kairo Ryu-Ge Emva\": puedes Invocar esta carta de Modo Especial desde tu Cementerio. Puedes poner 1 \"Reino Ryu-Ge - Chapiteles de Mar\" que controles en la parte inferior del Deck; destierra toda la mano de tu adversario y, si lo haces, \u00e9ste roba el mismo n\u00famero de cartas. S\u00f3lo puedes usar cada efecto de \"Kairo Ryu-Ge Emva\" una vez por turno."
    },
    "ja": {
      "name": "\u6d77\u7027\u7adc\u83ef\uff0d\u6df5\u5df4",
      "effect": "\u3053\u306e\u30ab\u30fc\u30c9\u540d\u306e\u2460\u2461\u2462\u306e\u52b9\u679c\u306f\u305d\u308c\u305e\u308c\uff11\u30bf\u30fc\u30f3\u306b\uff11\u5ea6\u3057\u304b\u4f7f\u7528\u3067\u304d\u306a\u3044\u3002\u2460\uff1a\u3053\u306e\u30ab\u30fc\u30c9\u3092\u624b\u672d\u304b\u3089\u6368\u3066\u3066\u767a\u52d5\u3067\u304d\u308b\u3002\u30c7\u30c3\u30ad\u304b\u3089\u300c\u767b\u7adc\u83ef\u6d77\u7027\u9580\u300d\uff11\u679a\u3092\u624b\u672d\u306b\u52a0\u3048\u308b\u3002\u2461\uff1a\u300c\u6d77\u7027\u7adc\u83ef\uff0d\u6df5\u5df4\u300d\u4ee5\u5916\u306e\u30e2\u30f3\u30b9\u30bf\u30fc\u304c\u624b\u672d\u30fb\u30c7\u30c3\u30ad\u304b\u3089\uff12\u4f53\u4ee5\u4e0a\u5893\u5730\u3078\u9001\u3089\u308c\u305f\u30bf\u30fc\u30f3\u306e\u81ea\u5206\u30e1\u30a4\u30f3\u30d5\u30a7\u30a4\u30ba\u306b\u767a\u52d5\u3067\u304d\u308b\u3002\u3053\u306e\u30ab\u30fc\u30c9\u3092\u5893\u5730\u304b\u3089\u7279\u6b8a\u53ec\u559a\u3059\u308b\u3002\u2462\uff1a\u81ea\u5206\u30d5\u30a3\u30fc\u30eb\u30c9\u306e\u8868\u5074\u8868\u793a\u306e\u300c\u767b\u7adc\u83ef\u6d77\u7027\u9580\u300d\uff11\u679a\u3092\u30c7\u30c3\u30ad\u306e\u4e00\u756a\u4e0b\u306b\u623b\u3057\u3066\u767a\u52d5\u3067\u304d\u308b\u3002\u76f8\u624b\u306e\u624b\u672d\u3092\u5168\u3066\u9664\u5916\u3057\u3001\u305d\u306e\u679a\u6570\u5206\u3060\u3051\u76f8\u624b\u306f\u30c9\u30ed\u30fc\u3059\u308b\u3002"
    },
    "ko": {
      "name": "\ud574\ub871\ub8e1\ud654\uff0d\uc5f0\ud30c",
      "effect": "\uc774 \uce74\ub4dc\uba85\uc758 \u2460\u2461\u2462\uc758 \ud6a8\uacfc\ub294 \uac01\uac01 1\ud134\uc5d0 1\ubc88\ubc16\uc5d0 \uc0ac\uc6a9\ud560 \uc218 \uc5c6\ub2e4. \u2460: \uc774 \uce74\ub4dc\ub97c \ud328\uc5d0\uc11c \ubc84\ub9ac\uace0 \ubc1c\ub3d9\ud560 \uc218 \uc788\ub2e4. \ub371\uc5d0\uc11c \"\ub4f1\ub8e1\ud654\ud574\ub871\ubb38\" 1\uc7a5\uc744 \ud328\uc5d0 \ub123\ub294\ub2e4. \u2461: \"\ud574\ub871\ub8e1\ud654\uff0d\uc5f0\ud30c\" \uc774\uc678\uc758 \ubaac\uc2a4\ud130\uac00 \ud328 / \ub371\uc5d0\uc11c 2\uc7a5 \uc774\uc0c1 \ubb18\uc9c0\ub85c \ubcf4\ub0b4\uc9c4 \ud134\uc758 \uc790\uc2e0 \uba54\uc778 \ud398\uc774\uc988\uc5d0 \ubc1c\ub3d9\ud560 \uc218 \uc788\ub2e4. \uc774 \uce74\ub4dc\ub97c \ubb18\uc9c0\uc5d0\uc11c \ud2b9\uc218 \uc18c\ud658\ud55c\ub2e4. \u2462: \uc790\uc2e0 \ud544\ub4dc\uc758 \uc55e\uba74 \ud45c\uc2dc\uc758 \"\ub4f1\ub8e1\ud654\ud574\ub871\ubb38\" 1\uc7a5\uc744 \ub371 \ub9e8 \uc544\ub798\ub85c \ub418\ub3cc\ub9ac\uace0 \ubc1c\ub3d9\ud560 \uc218 \uc788\ub2e4. \uc0c1\ub300\uc758 \ud328\ub97c \uc804\ubd80 \uc81c\uc678\ud558\uace0, \uadf8 \ub9e4\uc218\ub9cc\ud07c\ub9cc \uc0c1\ub300\ub294 \ub4dc\ub85c\uc6b0\ud55c\ub2e4."
    },
    "zh-CN": {
      "name": "\u6d77\u7027\u9f99\u534e\uff0d\u6e0a\u8f6e\u5df4\u738b",
      "effect": "\u6b64\u5361\u540d\u7684\u2460\u2461\u2462\u6548\u679c\uff11\u56de\u5408\u4ec5\u53ef\u5404\u4f7f\u7528\uff11\u6b21\u3002\u2460\uff1a\u4ece\u624b\u724c\u5c06\u6b64\u5361\u820d\u5f03\u53ef\u4ee5\u53d1\u52a8\u3002\u4ece\u724c\u7ec4\u5c06\uff11\u5f20\u201c\u767b\u9f99\u534e\u6d77\u7027\u95e8\u201d\u52a0\u5165\u624b\u724c\u3002\u2461\uff1a\u5728\u6709\u201c\u6d77\u7027\u9f99\u534e\uff0d\u6e0a\u8f6e\u5df4\u738b\u201d\u4ee5\u5916\u7684\u3001\uff12\u53ea\u4ee5\u4e0a\u602a\u517d\u4ece\u624b\u724c\u30fb\u724c\u7ec4\u88ab\u9001\u81f3\u5893\u5730\u7684\u56de\u5408\u7684\u81ea\u5df1\u7684\u4e3b\u8981\u9636\u6bb5\u53ef\u4ee5\u53d1\u52a8\u3002\u4ece\u5893\u5730\u5c06\u6b64\u5361\u7279\u6b8a\u53ec\u5524\u3002\u2462\uff1a\u5c06\u81ea\u5df1\u573a\u4e0a\u7684\uff11\u5f20\u8868\u4fa7\u8868\u793a\u201c\u767b\u9f99\u534e\u6d77\u7027\u95e8\u201d\u653e\u56de\u724c\u7ec4\u6700\u4e0b\u9762\u53ef\u4ee5\u53d1\u52a8\u3002\u5c06\u5bf9\u624b\u7684\u624b\u724c\u5168\u90e8\u9664\u5916\uff0c\u5bf9\u624b\u4f9d\u5176\u5f20\u6570\u62bd\u724c\u3002"
    }
  },
  "cardType": "monster",
  "attribute": "water",
  "type": "seaserpent",
  "classifications": [
    "effect"
  ],
  "level": 10,
  "atk": 3000,
  "def": 2000,
  "passwords": [
    "20904475"
  ],
  "images": [
    {
      "id": "c37334bd-5f39-4ef6-b1ea-a037a5034dbf",
      "password": "20904475",
      "art": "https://images.ygoprodeck.com/images/cards_cropped/20904475.jpg",
      "card": "https://images.ygoprodeck.com/images/cards/20904475.jpg",
      "lastChecked": "2026-10-31T02:53:52.439280"
    }
  ],
  "sets": [
    "7f73f931-05f6-43e4-acb2-44055a14e84a",
    "7f73f931-05f6-43e4-acb2-44055a14e84a",
    "7f73f931-05f6-43e4-acb2-44055a14e84a",
    "7f73f931-05f6-43e4-acb2-44055a14e84a",
    "7f73f931-05f6-43e4-acb2-44055a14e84a",
    "7f73f931-05f6-43e4-acb2-44055a14e84a",
    "9f454471-bba7-4d0e-87fd-1e07d8160c2e",
    "9f454471-bba7-4d0e-87fd-1e07d8160c2e",
    "9f454471-bba7-4d0e-87fd-1e07d8160c2e",
    "9f454471-bba7-4d0e-87fd-1e07d8160c2e",
    "9f454471-bba7-4d0e-87fd-1e07d8160c2e",
    "9f454471-bba7-4d0e-87fd-1e07d8160c2e",
    "956c17fc-1e3c-4940-a13e-0723638f92dd"
  ],
  "legality": {},
  "masterDuel": {
    "rarity": "sr",
    "craftable": true
  },
  "externalIDs": {
    "yugipedia": [
      {
        "name": "Kairo Ryu-Ge Emva",
        "id": 1074484
      }
    ],
    "dbID": 20593,
    "ygoprodeck": {
      "id": 20904475,
      "name": "kairo-ryu-ge-emva-14670"
    }
  },
  "series": [
    "074c00f7-fd75-41d2-962d-ed159a8ce772"
  ]
}