{
  "$schema": "https://raw.githubusercontent.com/DjobaDELATV/seygo_data/main/schema/v1/card.json",
  "id": "d9a8a373-e61f-41b9-a575-0262e2500b3e",
  "text": {
    "en": {
      "name": "Danipon",
      "effect": "When this card is destroyed by battle and sent to the GY: You can add 1 Insect monster with 1000 or less DEF from your Deck to your hand."
    },
    "fr": {
      "name": "Danipon",
      "effect": "Lorsque cette carte est d\u00e9truite au combat et envoy\u00e9e au Cimeti\u00e8re : vous pouvez ajouter 1 monstre Insecte avec max. 1000 DEF depuis votre Deck \u00e0 votre main."
    },
    "de": {
      "name": "Danipon",
      "effect": "Wenn diese Karte durch Kampf zerst\u00f6rt und auf den Friedhof gelegt wird: Du kannst deiner Hand 1 Insekt-Monster mit 1000 oder weniger DEF von deinem Deck hinzuf\u00fcgen."
    },
    "it": {
      "name": "Danipon",
      "effect": "Quando questa carta viene distrutta in battaglia e mandata al Cimitero: puoi aggiungere 1 mostro Insetto con DEF 1000 o inferiore dal tuo Deck alla tua mano."
    },
    "pt": {
      "name": "Danipon",
      "effect": "Quando este card for destru\u00eddo em batalha e enviado para o Cemit\u00e9rio: voc\u00ea pode adicionar 1 monstro Inseto com 1000 ou menos de DEF do seu Deck \u00e0 sua m\u00e3o."
    },
    "es": {
      "name": "Danipon",
      "effect": "Cuando esta carta es destruida en batalla y mandada al Cementerio: puedes a\u00f1adir a tu mano 1 monstruo Insecto con 1000 DEF o menos en tu Deck."
    },
    "ja": {
      "name": "\u30c0\u30cb\u30dd\u30f3",
      "effect": "\u3053\u306e\u30ab\u30fc\u30c9\u304c\u6226\u95d8\u306b\u3088\u3063\u3066\u7834\u58ca\u3055\u308c\u5893\u5730\u3078\u9001\u3089\u308c\u305f\u6642\u3001\u81ea\u5206\u306e\u30c7\u30c3\u30ad\u304b\u3089\u5b88\u5099\u529b\uff11\uff10\uff10\uff10\u4ee5\u4e0b\u306e\u6606\u866b\u65cf\u30e2\u30f3\u30b9\u30bf\u30fc\uff11\u4f53\u3092\u624b\u672d\u306b\u52a0\u3048\u308b\u4e8b\u304c\u3067\u304d\u308b\u3002"
    },
    "ko": {
      "name": "\ub2e4\ub2c8\ud3f0",
      "effect": "\uc774 \uce74\ub4dc\uac00 \uc804\ud22c\uc5d0 \uc758\ud574\uc11c \ud30c\uad34\ub418\uc5b4 \ubb18\uc9c0\ub85c \ubcf4\ub0b4\uc84c\uc744 \ub54c, \uc790\uc2e0\uc758 \ub371\uc5d0\uc11c \uc218\ube44\ub825 1000 \uc774\ud558\uc758 \uace4\ucda9\uc871 \ubaac\uc2a4\ud130 1\uc7a5\ub97c \ud328\uc5d0 \ub123\uc744 \uc218 \uc788\ub2e4."
    }
  },
  "cardType": "monster",
  "attribute": "earth",
  "type": "insect",
  "classifications": [
    "effect"
  ],
  "level": 2,
  "atk": 600,
  "def": 600,
  "passwords": [
    "48588176"
  ],
  "images": [
    {
      "id": "14ce54d3-4d30-46c2-a653-dc3007f3499e",
      "password": "48588176",
      "art": "https://images.ygoprodeck.com/images/cards_cropped/48588176.jpg",
      "card": "https://images.ygoprodeck.com/images/cards/48588176.jpg",
      "lastChecked": "2026-10-24T15:07:33.604071"
    }
  ],
  "sets": [
    "be5e2af2-3947-41f8-b549-67cbfb3ab90e",
    "be5e2af2-3947-41f8-b549-67cbfb3ab90e",
    "be5e2af2-3947-41f8-b549-67cbfb3ab90e",
    "be5e2af2-3947-41f8-b549-67cbfb3ab90e",
    "be5e2af2-3947-41f8-b549-67cbfb3ab90e",
    "be5e2af2-3947-41f8-b549-67cbfb3ab90e",
    "c8eff836-74f6-413f-9f1c-edd89123f0ea",
    "c8eff836-74f6-413f-9f1c-edd89123f0ea",
    "c8eff836-74f6-413f-9f1c-edd89123f0ea",
    "c8eff836-74f6-413f-9f1c-edd89123f0ea",
    "c8eff836-74f6-413f-9f1c-edd89123f0ea",
    "58da3411-6350-4813-824c-4602696fbfe7",
    "b9f12560-477e-4948-95bc-45ac3412030e",
    "ee72f9da-2019-4cf6-984a-2c64a2ccfead",
    "3d2e4dea-5966-4be2-af7c-69b239771ae7"
  ],
  "legality": {
    "tcg": {
      "current": "unlimited",
      "currentLegality": "unlimited"
    },
    "ocg": {
      "current": "unlimited",
      "currentLegality": "unlimited"
    },
    "speed": {
      "current": "unlimited",
      "currentLegality": "unlimited"
    },
    "genesys": {
      "current": "unlimited",
      "currentLegality": "unlimited",
      "currentPoints": 0
    }
  },
  "masterDuel": {
    "rarity": "r",
    "craftable": true
  },
  "duelLinks": {
    "rarity": "r"
  },
  "externalIDs": {
    "yugipedia": [
      {
        "name": "Danipon",
        "id": 514685
      }
    ],
    "dbID": 8856,
    "ygoprodeck": {
      "id": 48588176,
      "name": "danipon-4150"
    },
    "yamlyugiID": 48588176
  },
  "series": []
}