{
  "$schema": "https://raw.githubusercontent.com/DjobaDELATV/seygo_data/main/schema/v1/card.json",
  "id": "aa8a49eb-8e1b-4c9b-8b3d-9b4e621c6450",
  "text": {
    "en": {
      "name": "Level Tuning",
      "effect": "Reduce the Level of all face-up monsters you control by 1, until the End Phase."
    },
    "fr": {
      "name": "R\u00e9glage de Niveau",
      "effect": "R\u00e9duisez le Niveau de tous les monstres face recto que vous contr\u00f4lez de 1, jusqu'\u00e0 la End Phase."
    },
    "de": {
      "name": "Stufeneinstellung",
      "effect": "Reduziere bis zur End Phase die Stufe aller offenen Monster, die du kontrollierst, um 1."
    },
    "it": {
      "name": "Aggiustamento di Livello",
      "effect": "Riduci il Livello di tutti i mostri scoperti che controlli di 1, fino all'End Phase."
    },
    "es": {
      "name": "Calibraci\u00f3n del Nivel",
      "effect": "Reduce en 1 el Nivel de todos los monstruos boca arriba que controles, hasta la End Phase."
    },
    "ja": {
      "name": "\u80fd\u529b\u8abf\u6574",
      "effect": "\u81ea\u5206\u30d5\u30a3\u30fc\u30eb\u30c9\u4e0a\u306b\u8868\u5074\u8868\u793a\u3067\u5b58\u5728\u3059\u308b\u5168\u3066\u306e\u30e2\u30f3\u30b9\u30bf\u30fc\u306e\u30ec\u30d9\u30eb\u3092\u30a8\u30f3\u30c9\u30d5\u30a7\u30a4\u30ba\u6642\u307e\u3067\uff11\u3064\u4e0b\u3052\u308b\u3002"
    },
    "ko": {
      "name": "\ub2a5\ub825 \uc870\uc815",
      "effect": "\uc790\uc2e0\uc758 \ud544\ub4dc \uc704\uc5d0 \uc55e\uba74 \ud45c\uc2dc\ub85c \uc874\uc7ac\ud558\ub294 \ubaa8\ub4e0 \ubaac\uc2a4\ud130\uc758 \ub808\ubca8\uc744 \uc5d4\ub4dc \ud398\uc774\uc988\uc2dc\uae4c\uc9c0 1\uac1c \ub0b4\ub9b0\ub2e4."
    }
  },
  "cardType": "spell",
  "subcategory": "normal",
  "passwords": [
    "74741494"
  ],
  "images": [
    {
      "id": "22f3a2bf-0cfd-4e6c-ac71-dd9627a071a8",
      "password": "74741494",
      "art": "https://images.ygoprodeck.com/images/cards_cropped/74741494.jpg",
      "card": "https://images.ygoprodeck.com/images/cards/74741494.jpg",
      "lastChecked": "2026-10-31T02:53:52.445448"
    }
  ],
  "sets": [
    "a806218b-a8c4-482f-89c9-7a727dda329a",
    "a806218b-a8c4-482f-89c9-7a727dda329a",
    "a806218b-a8c4-482f-89c9-7a727dda329a",
    "a806218b-a8c4-482f-89c9-7a727dda329a",
    "a806218b-a8c4-482f-89c9-7a727dda329a",
    "a806218b-a8c4-482f-89c9-7a727dda329a",
    "a806218b-a8c4-482f-89c9-7a727dda329a",
    "6f94416f-5f69-49e6-b329-2951c79bcab0"
  ],
  "legality": {
    "tcg": {
      "current": "unlimited",
      "currentLegality": "unlimited"
    },
    "ocg": {
      "current": "unlimited",
      "currentLegality": "unlimited"
    },
    "genesys": {
      "current": "unlimited",
      "currentLegality": "unlimited",
      "currentPoints": 0
    }
  },
  "masterDuel": {
    "rarity": "n",
    "craftable": true
  },
  "duelLinks": {
    "rarity": "n"
  },
  "externalIDs": {
    "yugipedia": [
      {
        "name": "Level Tuning",
        "id": 81569
      }
    ],
    "dbID": 7632,
    "ygoprodeck": {
      "id": 74741494,
      "name": "level-tuning-6289"
    },
    "yamlyugiID": 74741494
  },
  "series": []
}