{
  "$schema": "https://raw.githubusercontent.com/DjobaDELATV/seygo_data/main/schema/v1/card.json",
  "id": "ea3cb965-093f-433d-b0d8-8f46c6fdb70b",
  "text": {
    "en": {
      "name": "Manticore of Darkness",
      "effect": "During the End Phase, if this card is in the GY because it was sent there this turn: You can send 1 Beast, Beast-Warrior, or Winged Beast monster from your hand or face-up field to the GY; Special Summon this card from your GY."
    },
    "fr": {
      "name": "Manticore des T\u00e9n\u00e8bres",
      "effect": "Durant la End Phase, si cette carte est dans le Cimeti\u00e8re parce qu'elle y a \u00e9t\u00e9 envoy\u00e9e ce tour : vous pouvez envoyer 1 monstre B\u00eate, B\u00eate-Guerrier ou B\u00eate Ail\u00e9e depuis votre main ou Terrain face recto au Cimeti\u00e8re ; Invoquez Sp\u00e9cialement cette carte depuis votre Cimeti\u00e8re."
    },
    "de": {
      "name": "Manticore der Finsternis",
      "effect": "W\u00e4hrend der End Phase, falls sich diese Karte im Friedhof befindet, weil sie in diesem Spielzug dorthin gelegt wurde: Du kannst 1 Ungeheuer-, Ungeheuer-Krieger- oder Gefl\u00fcgeltes Ungeheuer-Monster von deiner Hand oder offen von deiner Spielfeldseite auf den Friedhof legen; beschw\u00f6re diese Karte als Spezialbeschw\u00f6rung von deinem Friedhof."
    },
    "it": {
      "name": "Manticora dell'Oscurit\u00e0",
      "effect": "Durante la End Phase, se questa carta \u00e8 nel Cimitero perch\u00e9 ci \u00e8 stata mandata in questo turno: puoi mandare 1 mostro Bestia, Guerriero-Bestia o Bestia Alata dalla tua mano o Terreno scoperto al Cimitero; Evoca Specialmente questa carta dal tuo Cimitero."
    },
    "pt": {
      "name": "Mant\u00edcora das Trevas",
      "effect": "Durante a Fase Final, se este card estiver no Cemit\u00e9rio porque foi enviado para l\u00e1 neste turno: voc\u00ea pode enviar 1 monstro Besta, Besta-Guerreira ou Besta Alada da sua m\u00e3o ou do campo com a face para cima para o Cemit\u00e9rio; Invoque este card por Invoca\u00e7\u00e3o-Especial do seu Cemit\u00e9rio."
    },
    "es": {
      "name": "Mant\u00edcora de la Oscuridad",
      "effect": "Durante la End Phase, si esta carta est\u00e1 en el Cementerio porque fue mandada all\u00ed este turno: puedes mandar al Cementerio 1 monstruo Bestia, Guerrero-Bestia o Bestia Alada en tu mano o boca arriba en el Campo; Invoca esta carta de Modo Especial desde tu Cementerio."
    },
    "ja": {
      "name": "\u6697\u9ed2\u306e\u30de\u30f3\u30c6\u30a3\u30b3\u30a2",
      "effect": "\u3053\u306e\u30ab\u30fc\u30c9\u304c\u5893\u5730\u3078\u9001\u3089\u308c\u305f\u30bf\u30fc\u30f3\u306e\u30a8\u30f3\u30c9\u30d5\u30a7\u30a4\u30ba\u6642\u3001\u81ea\u5206\u306e\u624b\u672d\u30fb\u30d5\u30a3\u30fc\u30eb\u30c9\u4e0a\u304b\u3089\u7363\u65cf\u30fb\u7363\u6226\u58eb\u65cf\u30fb\u9ce5\u7363\u65cf\u30e2\u30f3\u30b9\u30bf\u30fc\uff11\u4f53\u3092\u5893\u5730\u3078\u9001\u3063\u3066\u767a\u52d5\u3067\u304d\u308b\u3002\u3053\u306e\u30ab\u30fc\u30c9\u3092\u5893\u5730\u304b\u3089\u7279\u6b8a\u53ec\u559a\u3059\u308b\u3002"
    },
    "ko": {
      "name": "\uc554\ud751\uc758 \ub9cc\ud2f0\ucf54\uc5b4",
      "effect": "\uc774 \uce74\ub4dc\uac00 \ubb18\uc9c0\ub85c \ubcf4\ub0b4\uc9c4 \ud134\uc758 \uc5d4\ub4dc \ud398\uc774\uc988\uc2dc, \uc790\uc2e0\uc758 \ud328 / \ud544\ub4dc \uc704\uc5d0\uc11c \uc57c\uc218\uc871 / \uc57c\uc218\uc804\uc0ac\uc871 / \ube44\ud589\uc57c\uc218\uc871 \ubaac\uc2a4\ud130 1\uc7a5\uc744 \ubb18\uc9c0\ub85c \ubcf4\ub0b4\uace0 \ubc1c\ub3d9\ud560 \uc218 \uc788\ub2e4. \uc774 \uce74\ub4dc\ub97c \ubb18\uc9c0\uc5d0\uc11c \ud2b9\uc218 \uc18c\ud658\ud55c\ub2e4."
    },
    "zh-TW": {
      "name": "\u6697\u9ed1\u7684\u880d\u5c3e\u7345",
      "effect": "\u6b64\u5361\u88ab\u9001\u5165\u5893\u5730\u56de\u5408\u7684\u7ed3\u675f\u9636\u6bb5\u65f6\uff0c\u53ef\u4ece\u6211\u65b9\u624b\u724c\u3001\u573a\u4e0a\u5c061\u53ea\u517d\u65cf\u3001\u517d\u6218\u58eb\u65cf\u3001\u9e1f\u517d\u65cf\u602a\u517d\u9001\u5165\u5893\u5730\u5e76\u53d1\u52a8\u3002\u4ece\u5893\u5730\u7279\u6b8a\u53ec\u5524\u6b64\u5361\u3002"
    }
  },
  "cardType": "monster",
  "attribute": "fire",
  "type": "beastwarrior",
  "classifications": [
    "effect"
  ],
  "level": 6,
  "atk": 2300,
  "def": 1000,
  "passwords": [
    "77121851"
  ],
  "images": [
    {
      "id": "cb2365ab-3b13-422c-ba19-1d4fc7b93951",
      "password": "77121851",
      "art": "https://images.ygoprodeck.com/images/cards_cropped/77121851.jpg",
      "card": "https://images.ygoprodeck.com/images/cards/77121851.jpg",
      "lastChecked": "2026-10-31T02:53:52.455641"
    }
  ],
  "sets": [
    "820278ea-de3f-4ebc-a464-b2b0a23ae4b9",
    "820278ea-de3f-4ebc-a464-b2b0a23ae4b9",
    "820278ea-de3f-4ebc-a464-b2b0a23ae4b9",
    "820278ea-de3f-4ebc-a464-b2b0a23ae4b9",
    "820278ea-de3f-4ebc-a464-b2b0a23ae4b9",
    "69b5baee-d21d-400c-9022-d53c5070a5ec",
    "69b5baee-d21d-400c-9022-d53c5070a5ec",
    "69b5baee-d21d-400c-9022-d53c5070a5ec",
    "69b5baee-d21d-400c-9022-d53c5070a5ec",
    "69b5baee-d21d-400c-9022-d53c5070a5ec",
    "69b5baee-d21d-400c-9022-d53c5070a5ec",
    "c4047c8b-f65c-454f-a5c7-501f777c0ce0",
    "c4047c8b-f65c-454f-a5c7-501f777c0ce0",
    "c4047c8b-f65c-454f-a5c7-501f777c0ce0",
    "c4047c8b-f65c-454f-a5c7-501f777c0ce0",
    "c4047c8b-f65c-454f-a5c7-501f777c0ce0",
    "c4047c8b-f65c-454f-a5c7-501f777c0ce0",
    "c4047c8b-f65c-454f-a5c7-501f777c0ce0",
    "c4047c8b-f65c-454f-a5c7-501f777c0ce0",
    "4f827a2c-4191-4f56-877f-cbaeff10f213",
    "4f827a2c-4191-4f56-877f-cbaeff10f213",
    "4f827a2c-4191-4f56-877f-cbaeff10f213",
    "4f827a2c-4191-4f56-877f-cbaeff10f213",
    "787eb4b4-1170-4d19-b7dd-5b00cc5837b8",
    "787eb4b4-1170-4d19-b7dd-5b00cc5837b8",
    "787eb4b4-1170-4d19-b7dd-5b00cc5837b8",
    "787eb4b4-1170-4d19-b7dd-5b00cc5837b8",
    "787eb4b4-1170-4d19-b7dd-5b00cc5837b8",
    "787eb4b4-1170-4d19-b7dd-5b00cc5837b8",
    "058c0e9f-b5f3-40f2-b80b-e55ea29a152b",
    "058c0e9f-b5f3-40f2-b80b-e55ea29a152b",
    "1393a0bd-054c-4d5e-8be5-c554386e41f8",
    "d96f2bf7-a3ab-4ec6-b3c8-e487b5d7b75b",
    "d96f2bf7-a3ab-4ec6-b3c8-e487b5d7b75b",
    "d96f2bf7-a3ab-4ec6-b3c8-e487b5d7b75b",
    "134f8313-c534-4cf8-b967-8d1efb327bef",
    "134f8313-c534-4cf8-b967-8d1efb327bef",
    "134f8313-c534-4cf8-b967-8d1efb327bef",
    "134f8313-c534-4cf8-b967-8d1efb327bef",
    "134f8313-c534-4cf8-b967-8d1efb327bef"
  ],
  "legality": {
    "tcg": {
      "current": "unlimited",
      "currentLegality": "unlimited",
      "history": [
        {
          "legality": "semilimited",
          "date": "2004-04-19"
        },
        {
          "legality": "unlimited",
          "date": "2009-03-01"
        }
      ]
    },
    "ocg": {
      "current": "unlimited",
      "currentLegality": "unlimited",
      "history": [
        {
          "legality": "semilimited",
          "date": "2003-10-15"
        },
        {
          "legality": "unlimited",
          "date": "2009-03-01"
        }
      ]
    },
    "genesys": {
      "current": "unlimited",
      "currentLegality": "unlimited",
      "currentPoints": 0
    },
    "speed": {
      "current": "unlimited",
      "currentLegality": "unlimited"
    }
  },
  "masterDuel": {
    "rarity": "sr",
    "craftable": true
  },
  "externalIDs": {
    "yugipedia": [
      {
        "name": "Manticore of Darkness",
        "id": 178
      }
    ],
    "dbID": 5881,
    "ygoprodeck": {
      "id": 77121851,
      "name": "manticore-of-darkness-6490"
    },
    "yamlyugiID": 77121851
  },
  "series": []
}